"Yeah, it's a wrap for body positivity SJWs",,
Critical support for neither femboy nor bara catboys. This tweet is a catboy body positivity tweet.,,
Body positivity,,
"she tries to spread positivity until it comes to a different topic, she loves her body, thats great! until it comes to skinny, average, or any other body, aka narcissism",,
"As much as I love Shudu she hasnt been influential...besides the body positivity she hasnt spoken on any current societal injustices , no encouraging words regarding the virus , charity work donating to people affected by the pandemic , naaaaathing just hot girl summer",,
Body positivity!!!!!!! Confidence!!!!!!,,
. Lana Del Rey - Ride . Rihanna - SnM (it went very wrong) . Oliver Tree - Alien Boy . Basic but Megan Thee Stallion - Body (cos of my recent body positivity vibes),,
Body Positivity yunno,,
Body Positivity,,
Your body doesn't change you. Don't judge yourself in a cynical way. Learn to appreciate yourself in a way that no one can. Surround yourself with love and not negative positivity. Just remember that life is too temporary to do anything but enjoy your life.,,
Hey y'all! and I are hosting a body positivity telegram group chat for all furries lookin for positive vibes only!! This chat is + ONLY!!,,
"Just move, smile, enjoy. Namaste",,
"I wonder if TikTok know that they didn't ""normalize"" plussized people, they just forced them to constantly talk about body positivity or make their whole account about body positivity in order to get less hate, if they post normal videos, they get bodyshamed so fucking hard.",,
"yall are all about anti body shaming and body positivity but body shame noah beck like ?? u cant pick and choose body positivity bruh, the only person u can body shame is tr*mp",,
Take care of your body. It's the only place you have to live. Jim Rohn,,
Valuable skill to show your kids about African body positivity but y'all are playing,,
Your body doesn't define you. Don't think about yourself in a negative way. Learn to love yourself in a way that your partner can. Surround yourself with appreciation and not negative positivity. Just remember that life is too short to do anything but enjoy your life.,,
Since Noah beck is trending.. it makes me wonder one thing. Why do the same people who are making fun of him and his neck also preach body positivity and mental health awareness? Like I get hes not perfect and he has done shitty stuff but like hypocritical much...,,
I just wanna spread some body positivity.,,
Bitches be all about body positivity and preach women empowerment across all social media accounts but still talk shit about those same womens backs,,
Contemporary body positivity makes it incumbent on people with nonconforming bodies to change their own self-perception without requiring anyone with any power to question what created the phenomenon in the first place.,,
When you look at the body positivity pushed today. This is evil... Big is beautiful But realistically this is incredible guy on the left dies of a heart attack at ... on the right he lives a good long healthy life!!!,,
yk that brooklyne girl on tiktok yeah body positivity yeah she posts so many tiktoks about it like her page is full with it I have no problem but its kinda annoying,,
"We are Body Language Clothing! Living &amp; walking in positivity, let your clothes speak for you! DM for orders, good prices",,
"We are Body Language Clothing! Living &amp; walking in positivity, let your clothes speak for you! DM for orders, good prices",,
These Body-Positive Self-Portraits Encourage Women To Love Their Flaws via,,
U the same type of stan to talk bout body positivity,,
"but I definitely hurt less than the last time I went through this. I understand the different lifestyles other people have and see the privilege I have to be able to say this, but Im very proud of me; and I want to share my truth. Body positivity comes in all shapes and sizes.",,
"physically healthier get more out of my retirement years. As far as going on a diet or going through a lifestyle change, health has been my concern and it is what is making the biggest difference for me this time. My body positivity today is that I hurt today,",,
yall preach body positivity until you want to joke about someones insecurities they cant control,,
people be like body positivity until they see someone with a skin condition,,
"We are Body Language Clothing! Living &amp; walking in positivity, let your clothes speak for you! DM for orders, good prices",,
"We are Body Language Clothing! Living &amp; walking in positivity, let your clothes speak for you! DM for orders, good prices",,
Yes please love the body positivity,,
"We are Body Language Clothing! Living &amp; walking in positivity, let your clothes speak for you! DM for orders, good prices",,
"Sorry if I was bitchy. Its the age of body positivity, Id love for him to be fat and proud on that boat. Obviously I dont know him or his reasons and I shouldve just shut up. Again, my apologies.",,
"We are Body Language Clothing! Living &amp; walking in positivity, let your clothes speak for you! DM for orders, good prices",,
body positivity is always good! except when youre don !!!,,
"Ty again for a wonderful night, we just chilled and chatted about coomin', body positivity, smokin' broken windows, all that. and even had my internet die half way though, but there's just no stoppin' once you're coomin'. Here's a clip of a fallen chatter who, coomed and went.",,
"and liiiike fat acceptance and body positivity I think are a lot of why I was able to start accepting my body which helped me finaly get to a point whre I was ALSO abl to accept that like... I am not a girl lol. I am not even like, a nonbinary woman.",,
"which was uh I was fine for awhile after? but I still felt like shit. so I focused all my energy into Body Positivity, thinking it was social messaging about my no being a Perfect Thin Tall Model that was behind my discomfort with my body....",,
Me today. Fully on my journey to self and body positivity,,
if miss red's king was wicknell then I approve .fat gals for fat boys.otherwise lets not celebrate obesity under the guise of body positivity..miss red cant even run away from a rabid dog or potential muggers..shes as vulnerable as a baby coz of all tht weight.,,
"We are Body Language Clothing! Living &amp; walking in positivity, let your clothes speak for you! DM for orders, good prices",,
Take care of your body. It's the only place you have to live. Jim Rohn,,
"We are Body Language Clothing! Living &amp; walking in positivity, let your clothes speak for you! DM for orders, good prices",,
"We are Body Language Clothing! Living &amp; walking in positivity, let your clothes speak for you! DM for orders, good prices",,
"hi i have a purging addiction and im currently doing my best to recover please shut the fuck up. she didnt ask you. she made this post for body positivity, you have no right to shame her or comment on her body. stfu. now. youre nothing but cruel.",,
Y'all all about body positivity till you feel the need to bring someone down,,
"Agreed, however body positivity should go both ways. Men are equally as insecure as women. The amount of comments Noah gets daily about his body is crazy and when he finally feels confident about himself and posts pictures, he starts trending like really wtf",,
im all about body positivity... but how are some of yall built like a mucinex germ,,
"This damn internet gonna fake ""body positivity "" these humans to an early grave.",,
Nahh man its body positivity all . Rock that mf.,,
Exactly...then if someone talks about them in same way.....these people will start talking about body positivity and this and that,,
When and why did we normalize such self-obsession and borderline porn (or.. body positivity??) on Instagram?,,
yall i understand that yall dont like noah beck but the way people are trashing his physical appearance rn is too much. so much for body positivity?? let him have his himbo pics in peace,,
"Hi this is a vent I was just starting to have body positivity and it was just absolutely obliterated, thanks life",,
Nah man I wanna see some girls shake sum ass for body positivity of course,,
yall ever seen someone whos fueled your eating disorder go and post body positivity stuff on instagram,,
Your body doesn't make you. Don't manifest yourself in a negative way. Learn to admire yourself in a way that no one can. Surround yourself with love and not negative positivity. Just remember that life is too short to do anything but relish your life.,,
"We are Body Language Clothing! Living &amp; walking in positivity, let your clothes speak for you! DM for orders, good prices",,
"And women rightfully demand body positivity, and to cease body shaming, yet y'all seem to have no issue body shaming men for their height. It's incredibly hypocritical.",,
"Seeing more and more selfie posts like this in the past year- those and honestly? Finding transmasc NSFW Twitter accounts has really upped my body positivity and reduced my dysphoria, to where I feel comfortable without a shirt in my own home. Its been amazing!!",,
STARTS SHAKING HEAVILY PLEASE LORD SAVE ME FROM THIS BODY THAT CANNOT PROCESS TOO MUCH POSITIVITY AT ONE MOMENT OR I EXPLODE A HAPPY BOMB I LOVE U FELIX SM /pos /gen,,
"So adorable. Great thread too! Thanks, nice to read so much cute and I loved the body positivity stuff extra",,
"oh for why haha streamers dream feels like the older brother ive never had, i trust him a lot. hes protective of his friends and gives them gifts and makes them feel loved a lot. karls vibe is comofrt and so is niki plus she speaks body positivity and her voice and everything",,
Anyone who does yoga will tell you that its more than just difficult poses and positive affirmations; its not about incense and frills. Yoga is a lifestyle and approach to positivity which seeks to enlighten the spirit and attune body and mind.,,
"This right here, is the opposite of body positivity. Oop",,
can we just stop with this rlly weird fake body positivity shit... like idk who identifies with someone elses body or features anyway so it just rlly doesnt feel right how ok everyone is with bringing ppls looks into everything...,,
"So yesterday turned out to be quite horrible and this provided a breath of positivity. As always. Thanks, The Body Serve | Is It Worth It?",,
niki talking about body positivity is everything.,,
I'm feelin that body positivity after my workout this evening,,
Anyways body positivity,,
"I'm all for body positivity but I've always liked the term body neutrality. Like I really don't have much feeling towards my body, I prefer not to think about it at all. As long as I'm mostly healthy...and alive, I'm good with that.",,
"My life was way better before my high schoolers told me that Gwenyth sells a candle ... scented like ... ... ... uh ... her ... uh ... vagina. I mean, I am all for body positivity, for using science words when I talk to my kids about these things, but this. Is beyond me. Whyyyy.",,
Your body doesn't define you. Don't think about yourself in a pessimistic way. Learn to appreciate yourself in a way that your partner can. Surround yourself with admiration and not negative positivity. Just remember that life is too temporary to do anything but love your life.,,
"Exactly, if she have that right to body shame sonia, then sana can also be treated same, y such selective positivity",,
fuck it im posting body positivity cuz im happy with my journey and it wasnt easy lol,,
"of all the things wrong on the app, body positivity-shoot with baker is not it",,
body positivity but only for the top half of everyones bodies... legs are disgusting,,
"When you preach about body positivity for views but call other women fat in private. I know who you are girl, you dont have to front online..",,
"""that's so mean..."" ""yeah why don't they call him mr. beautiful to promote body positivity""",,
fellow gorjus plus size peeps. Does it bother you when body positivity posts only include hourglass shaped plus size people? Cs it lolwey makes me frustrated cs my body looks nothing like that and ill only be deemed acceptable if i had that curvy figure. Idk if it makes sense lol,,
I agree with this about body positivity &amp; nudity on twitch. I removed it due to the discussion from MPAW in this tweet.,,
// body image hate (on myself) i see body positivity posts that r like its ok to have a little chub some places&lt;3 and the girl in question just has like thick thighs or something. im gonna punch someone so hard,,
Literally nothing theyre claiming that she stole their work because they tweet random shit about feminism when her whole thing is body positivity,,
Never discredit your gut. You are not paranoid. Your body can pick up on vibrations that your mind cannot perceive.,,
"I get what the body positivity movement is trying to do, but the expansion of beauty standards to encompass more people is still exclusionary by nature. Not all bodies are beautiful because a body is not beautiful. Its a body. Its entire purpose is to carry your brain and to do",,
"Can shapeshift into other forms, but prefers to be in his 'sans' form since he is most comfortable with it. He is technically the older 'brother' Has a blind spot with only one working eye Wants to rid the world of positivity Must destroy every cell of his body to die",,
Fat bitches with body positivity in they captions,,
looking to sculptures from antiquity/the renaissance for body positivity inspiration re: Aphrodite is not the take u guys think it is the artists accentuated those features to emphasize their fertility and ability to bear children.....it is not body positivity it is Just Misogyny,,
"There has been a lot of people saying ""It's their content why do you care"" Well because as a woman I don't want to feel I need to get my itty breasts out to get viewers. I'm all for body positivity but Twitch is not the place for nudity. (RT was deleted)",,
"There has been a lot of people saying ""It's their content why do you care"" Well because as a woman I don't want to feel I need to get my itty bitty titties out to get viewers. I'm all for body positivity but Twitch is not the place for nudity.",,
Body positivity L,,
Bitches be like. Body positivity. Then shame a mf for a small d.,,
He said body positivity like he didnt just drag someones body. Both Kim and Chynas bodys are/were trash lets be but to take your time uplifting one and down into another is contradicting when they both have unnatural bodies.,,
Body positivity,,
"Oh, honey. Of course. Positivity for her and a reminder to breathe for you. Mamaing can be all consuming. Rememeber to breathe in when the body gets too tight in your skin and the prickly sensations sidle through.",,
"Okay, Im so sick of this add on Insta. Like wtf, the first post is some funny ass video. But then you swipe left and a super fit girl appears asking if you wanna get in shape. Im so freaking sick of this. Where is my BODY POSITIVITY. Does anyone else keep getting this add???",,
"listen, Im all for the body positivity involved with super short dresses, but how are yall able to tolerate even part of your bare buttcheeks directly touching the chair???? could not be me",,
"Like I would do episodes on college life in a pandemic, body positivity, Identify struggles and stuff like that and just have a convo with some cool ass smart people idk I think it would be fun and informative",,
how is tiktok simultaneously so body positivity!! and proana,,
"Check out this custom apparel by all about cannabis, mental health, and body positivity - Use code HOOKUP2021 for % off!",,
Take care of your body. It's the only place you have to live. Jim Rohn,,
Your body doesn't make you. Don't think about yourself in a pessimistic way. Learn to love yourself in a way that can. Surround yourself with love and not negative positivity. Just remember that life is too short to do anything but relish your life.,,