"I know I am not conventionally attractive. I've struggled with body positivity my whole life. I am also not blessed with a ""cute"" form of Autism. I'm very high functioning. But I also have a very obsessive personality. I will research something I heard on passing for hours l.",,
"you can support body positivity AND healthy eating, exercise, and weight loss. just saying.",,
how the fuck did she complaint yet validate why the body positivity movement is only for pls sized people in the same breathe ??,,
Yes I've scrolled through. Its about body positivity. Being more breast aware. I don't find it distasteful. Anything that raises awareness of checking your breasts is a good thing in my eyes.,,
Your body doesn't change you. Don't manifest yourself in a pessimistic way. Learn to admire yourself in a way that your friends can. Surround yourself with admiration and not negative positivity. Just remember that life is too brief to do anything but enjoy your life.,,
And it doesn't promote body positivity,,
Could see something like this working in the US slap some body positivity shit on that(probably not fat enough for US measurements though),,
jungkook is the most sweetest and humble person ever hes so hardworking and passionate about his work and that inspires many to work hard as well. he has spread nothing but love and positivity for all of us. his body art is also so beautiful and meaningful i love him so much,,
"Report this acc, he edited a video of a girl posting about body positivity and spoke ill about, not only that, he has the audacity to use vile language for gender neutral peeps, and basically he is one of those dEnK memers we have in the country REPORT :",,
My post about body positivity keeps getting more likes to this dayyyyyy,,
"A mind, body, spirit approach to cultivating strength, positivity and resiliency through connection and empowerment.",,
"Are we ready to discuss how the body positivity movement is toxic af &amp; promotes hatred towards those who want to become healthier? Women like Jasmine Sullivan, Jennifer Hudson, Adele got hella flack for losing weight.",,
"steps to break free from dieting: Learn to eat w/o tracking! Awareness is important but knowing your bodys cues is key. Improve your relationship with food! Stop obsessive food thoughts! Work on body positivity! Your body is yours forever, love it at every stage",,
"Extra tired &amp; weak since Peri/Menopause? As you age, your body loses its ability to absorb vitamin B-12 so your risk of vitamin B-12 deficiency increases. Get enough daily through fortified foods, supplements or optimally - almonds, chicken, eggs and fish",,
Body positivity. As someone with a c section scar I know the importance of seeing women deliberately choosing to love their bodies,,
early on the body positivity tip as well,,
Body positivity is also important.. she has campaigned on mental health awareness as well.,,
"So that ""every gay dream"" tweet going around today. I don't know how else to say this. Whether someone is ""fit &amp; in shape"" or not. It's still body shaming when you insult their build or express disgust in regards to their figure. Encourage body positivity. For everyone. Period.",,
"Dear people, Body positivity is not a competition of who is more marginalised in society. It has nothing to do with comparison. It's about the acceptance of ALL BODIES!! Yours, ThickNStylish",,
really need more body positivity in my live.,,
"I know that body positivity is de rigueur but I hate my body, so today I started an exercise regime and it was HORRRRRIBLE.",,
I find it weird that thin influencers realized people were exhausted by fitness content centered around being thin + rebranded into body positivity warriors. I hope a lot of it is genuine/that people worked through their own toxicity within themselves but im sus abt a lot of it,,
"Join us next Monday at pm for our first event of the semester, featuring professional model Tyla Regan Here we will discuss body positivity journeys, self love tips, mainstream media messages about Black Women and more! Click the link in our bio to access the event",,
But but ... BoDy PoSiTiViTy Woke culture is so funny,,
Body positivity as an individual solution to systemic problems.,,
Your body doesn't define you. Don't manifest yourself in a cynical way. Learn to love yourself in a way that can. Surround yourself with admiration and not negative positivity. Just remember that life is too brief to do anything but enjoy your life.,,
A picture of a thin person sucking in at :59 next to them in a relaxed pose at :00 is not body positivity lol,,
"I feel like people either muted or unfollowed me when I was posting body positivity. Eventually I kinda got uncomfortable with it bc it isn't something I normally do and if people were gonna shun me for it, it shook up the self confidence that isn't strong enough to not give af.",,
so you preach body positivity and how mean it is to body shame but then you go and body shame me and openly admit to it and think its funny? good job ill give you a medal for loser of the year!,,
I would think he'd be very grateful for the body positivity movement anyway.,,
Thanks it's about body positivity,,
Exactly!! Choose positivity. Your mind and body thank you.,,
Can social media ever be truly body positive? via,,
what does body positivity have to do with him not being hot,,
Body positivity gonna be the death of some of yall lol,,
Isn't being positive about your body part of body positivity?,,
"tw // nsfw(?), ed ment(?) . . . . . . . i believe that a technology that makes breast detachable would not only be very beneficial to trans people and/or people struggling with body positivity but it would also normalize some very funny sentences. a thread:",,
"A thread about body positivity &amp; mental health. When I was at uni, I was with someone who didn't give me the best body image, and it got to the point where I was going to the gym twice a day to stay skinny. I was a size , which was definitely too small for my height. /",,
"Anyway if this was all over the place it's because I don't want to seem like a braying jackass screaming about ""woke culture,"" because OBVIOUSLY there's value to body positivity framing.",,
"I'm turning soon. I gotta say something that may lost me some followers and make people mad at me: I'm a fat dude. It hadn't given me much trouble until I hit like a brick wall. ""Healthy at any size/body positivity"" can be dangerous when pushed to extremes (1/x)",,
heres ill get hate probably: body positivity doesnt mean normalize being unhealthy and overweight. theres a fine line between being fat and obese and theres no reason u should be obese unless you have a genuine medical condition that causes that. stop normalizing bad health,,
"Health? that's not even a double chin, thats a whole fucking ocean under her that's full of fat, oil and plastic. How can people like that talk about health? Looks like body positivity shit about to hit new heights with this one.",,
lets go ari supports body positivity,,
Legit they cant promote body positivity when they aint positive about their bodies in the first place!,,
"These pages will post only thin bodies and celebrate body positivity,... now theyre celebrating stretch marks on a thin woman",,
yes body positivity is when u are legally mandated to be attracted to every person ever,,
Awww your welcome it's about understanding body positivity ^^,,
"""Flaunt It"" I was having a moment of body positivity and wanted to express it through my fursona! Tazara would normally never wear something like this unless Drakyl asked or it was a special occasion.",,
Dropping these here to promote body positivity and self love,,
the fucking hypocrisy lmaoo body positivity! until its someone not conventionally attractive,,
Saying he isnt that hot has to do with body positivity. He just doesnt deserve all that hype when you see men like him at the drug store.,,
"(3/16) HISTORY TIME! The historical movement of ""Body Positivity"" was actually quite radical, but like so much, has been coopted by mainly white cis women and corporations. Subsequently, body positivity, in it's current iteration, is largely about loving yourself, but doesn't...",,
hes really not ugly why is everyone messing with him like yall aint never seen a photo shoot before lmao. Its all body positivity until people show off their body,,
It's just too bad the body positivity is promoted with those inherently transphobic words. And that is mixed in with trans and intersex fetishisation even though the art has nothing to do with trans people.,,
What abt body positivity?,,
BODY POSITIVITY??? lmfaoooo please yall just say anything atp,,
"I can agree with that. I don't use the term, ""Futanari"" as it degrades trans and intersex people, but I'd still like to see trans body positivity. Just don't call it ""trap"" ""shemale"" ""ladyboy"" all that rubbish, and I'm down.",,
my least favourite genre of body positivity is ig and twitter pages that post picture after picture of sexy posed naked bodies that fit the beauty standard and ON OCCASION post photo of a skinny person slouching and are like ah thats enough activism for me,,
"wow, you like guns? LOL you must have a small dick right? what a tiny cock loser! by the way, dont forget to support body positivity! all bodies are beautiful",,
Idk....yall can come after me but....I dont get how people alter their body structure surgically and still promote body positivity. Like u paid for a figure that the human body doesnt naturally have as a body type. I feel bad for the young girls that look up to these models,,
"i agree, but i also think everyone here talking bad about his appearance needs to stop because everyone talks about body positivity then they're body shaming him and calling him ugly. there's nothing wrong with not being attracted to him, but you do NOT body shame his",,
Yall say Body positivity than Shame a person for a photo shoot.,,
Body positivity is so important but so is your health dont forget to take care of yourself,,
After the Wishing Carrot we now have the Body Positivity Avocado. Full of good fat!,,
"Thicc is about body positivity, Karen. Your takes are all stupid and bad and I dont think you just get to call yourself a speaker for all women.",,
Body positivity won't save you from a heart attack fatty stop scrimming and start moving!,,
I wonder what their stance on body positivity is.,,
Making Thor fat shows fans around the world that they can be heroes no matter their shape or size and promotes body positivity. Smart Hulk was a good idea but failed in execution. Spider-Man is a mixed bag to me rn. AND YES WHY DID THEY KILL PIETRO?!,,
Today is Rid the World of Fad Diet and Gimmicks Day. Read more about how trying to balance body positivity and over-eating affects my anxiety in this piece I wrote for The Temper:,,
My sister did this painting to support body positivity.,,
my unpopular opinion is that I find body positivity very boring.,,
In the last three games there's positivity... You can see with the body language that there's work being put to improve the performance. Let's come back second half and finish the job. Ayikho indaba ya TTM.,,
"Lets spread some body positivity! Its been over years since Ive felt okay with my body, but slowly Im starting to love myself a lil more.",,
Your body doesn't define you. Don't manifest yourself in a cynical way. Learn to love yourself in a way that your friends can. Surround yourself with admiration and not negative positivity. Just remember that life is too brief to do anything but relish your life.,,
"What the body positivity movement got wrong was that it rooted itself in the idea, ""You are beautiful, no matter what society says."" Instead of, ""It doesn't matter whether or not you are beautiful."" Which is what it should have been.",,
"New blog post This week, I talk about my struggles with body positivity, how they translate within the industry and I even teamed up with a certified holistic wellness coach for some guidance. Check it out.",,
"a fucking white skinny blonde eye color chick talking about body positivity, like Arnold lambasting chris Farley for just breathing fat i mean",,
body positivity has nothing to do with this.,,
ok personally im not a fan but yall need to stop being horrible to noah beck bc ur the same ppl to preach mental health and body positivity but ur bullying him,,
"We know you've been waiting &amp; the next ep of is out now! This week, the hilarious and wickedly smart stops by &amp; chats seeing himself in gay media, the co-opting of body positivity by hot people &amp; G*ysOv*rC*vid. It's a wonderful conversation, check it out!",,
He looks healthy! You can be fat and healthy! Body positivity!,,
The body positivity movement is to show people you don't have to be an asshole to fat people because they are fat. Another person's health journey is none of your business.,,
"they dont just use their fame to perform and sell their music, they also use it as a platform to promote their own causes like being an lgbtq ally, anti-bullying, feminism/women empowerment, body positivity and charity works for the children in need. QUEENS!!!",,
i know my coach isnt talking about body positivity when she makes everyone who isnt a size feel like shit,,
How to stop body positivity.,,
"Absolutely! Anyone who faces any type of body shaming is included in the body positivity movement. My point was ppl who are skinny, w/o the detriments that come with it feel they're oppressed just bc there's a growing preference for body standards outside the eurocentric ideals",,
My generation gonna have hella folks on my lb life cause of body positivity.,,
"can you please post more of your body positivity? i'm having trouble with my mental health, and I love when you post tiny things appreciating yourself and others",,
"just a friendly reminder, stop promoting body positivity on your feed if you'll just continue to body shame people other people's bodies are none of your business btw",,
"Body positivity encompasses not just striving for optimal health, but also being kind to ourselves, embracing our physical selves, regardless of where we are in the process. It should never be about size or shape.",,
"Aw! Thank you. Growth working its way through the Body of Christ is different from ""positivity"" for self-aggrandizement.",,
"Body positivity yes, but some things are better kept under cloths",,
We are kicking off with a Body Positivity Movement! These will be daily motivational tips from people who have completed treatment. Here is to Day of Days of Hope!,,
"The fact that you can't decipher my comment, which really isn't complicated at all, doesn't say much for what's between your ears. I spoke about inspiration, a well educated woman like her should be an inspiration to young girls. Also body positivity is extremely vital an plays",,
"I readily admit that since life moved online I've felt more self conscious &amp; self critical than ever before. So this chat with about authenticity, growing older, body positivity, King David, nudes &amp; ancient ideas about gender really took off!",,
Im all for body positivity but when its just pure normalising obesity its dumb.,,
"I mean, I agree that overweightness is a problem, but body positivity is more about ppl who have naturally larger-looking bodies or different body types than what's considered ""pretty"" or whatever, but yeah, some people are so overweight it's actually a risk to their health",,
its the people who preach body positivity and then call tik tokers ugly. like how does that add up-,,
"""omg so braaave!!!"" It isn't healthy, people. Please don't be stupid. Body positivity agenda is bullshit, misleading and dangerous.",,
"Dont forget to promote high blood pressure, diabetes, and all the other health issues that come with your so-called body positivity.",,
You people say we should encourage body positivity but proceed to cook nella then wonder why she claps back at you,,
"Apparently I posted a pic in FB and IG and I got this comment. i still don't get the logic behind why people need to point out something about gaining weight or losing it. I mean, we're already in the year but despite all those body positivity trend and no to body shaming +",,
"Body positivity is one thing, unhealthy lifestyle and obesity is another. Dont conflate the two.",,
This TikToker is using her account to promote body positivity,,
the fact that im explicitly expressive with my body is NOT the reason why im a feminist. I dont support body positivity only because I like to show my body online. i support women because i support women - not when its convenient.,,
"Fair enough, but how could it best be mentioned in the blurb without giving much away? It's a pretty light hearted story mostly, focused on body positivity, consent and communication, there's some sex scenes. I'd rather not have readers worry about a sex scene taking a dark turn.",,
"You advocate for body positivity but cut your penis off, curious.",,
"I started off my morning so great. I read both my class syllabuses, I worked out, I spoke positivity to my body while getting dressed and told myself I am going to be positive and productive at work",,
"It was a long battle of self love ,unbothered-ness , acceptance and body positivity for in my part. Sometimes, I still feel conscious but hopefully someday, like this painting I'll be able to enjoy and be unbothered to focus on more important things in life.",,
"He was a body positivity king fgs, cant forget that",,
"I agree. I'm just angry at people who ignore those truly in need. They act like they're brave for supporting various causes while ignoring the ones that don't affect them. I.e. the support for body positivity, but no support for those in S. Africa killed because they're white",,
"If you think style is superficial, style coach and body positivity advocate Stasia Savasuk's personal story of how she redefined style might just change your mind ... and your wardrobe!",,
"This page will be the video and picture journal of my wellness and body positivity journey. A past struggle from a dark place, to the discovery of a sense of self and a brighter disposition Posts are for my own self confidence and motivation as I seek to find love for ME",,
Cheer up guyss let the positivity run in your body.,,
Im a big fan of body positivity but I dont really like to see obese people on magazines - pick one. You dont get to have both.,,
"My thoughts about body positivity: Being/aspiring to be healthy and plus sized body positivity aren't mutually exclusive. I mean it's not a healthy mindset to have for thoughts like ""I'm fat and so therefore I hate my body"". You can love your body and aspire to be healthier.",,
Oh don't forgett the bodyshaming while screeching at everybody of body positivity.,,
"If youre fat, go to the gym. Body positivity isnt going to save you from clogged blood.",,
your body art is literally one of the most beautiful things that ever existed thank you for making my night be filled with positivity iloveuall,,
"Im all for body positivity, but Im positive we dont want to see yours.",,
I think the body positivity movement is more so addressing the subject for a lot of folks who cant control it. It's more like making fun of a cancer patient for being bald because losing their hair is something they can't control with chemo. Lotta diseases make it hard to be lean,,
Body shaming against men goes so unchallenged and it's actually pretty gross. Like all body shaming is shallow and a shitty thing to do but feminism has done a great job with promoting body positivity and acceptance for women in recent years. A similar movement is needed for men.,,
body positivity,,
"why do people think supporting body positivity is ""normalising"" being fat when its not???? the whole point is you stop shaming people and allow them to live comfortably so they can actually make progress without feeling like shit about who they are",,
"Really sad tbh People don't want to eat better or develop better eating habits instead they want to make being fat as normal I'm all for body positivity in things like height, nose, ears etc. Features that can't be changed cause it's genetics",,
Would that indicate there is no positivity on twitter in your view? Confirming my initial comment. Yoga is great for improving your mind and body though,,
Your body doesn't make you. Don't manifest yourself in a negative way. Learn to love yourself in a way that can. Surround yourself with love and not negative positivity. Just remember that life is too brief to do anything but relish your life.,,
Now body shaming Noah Beck bruh. You can't advocate body positivity for just Women...,,
"Should be a thing around the world overweightness and obesity is a huge problem around the world and it's truly sad + sized celebrities advocate for ""body positivity"" instead encouraging people to fight this sickness",,
"Remember folks body positivity is sexy, imma chonkyboi and love every inch. Cause nothing beats a big warm n squishy cuddle c:",,
I'm on a body positivity and intuitive eating webinar and prepared for it by eating a slice of Xmas cake and a packet of scampi fries,,
"You must not have heard of the body positivity movement, for you to hold this opinion.",,
Shut the fuck up. Id like to see your face then huh cause i bet he looks times better than you. People love to preach about body positivity until they pull shit like this,,
"Take a break Sadie - from everything. Only surround yourself with positivity for a day or two. Turn your phone off if you can. Run and bath, or a shower, moisturise your body, light a candle, sit in silence, feel your sadness but don't identify with it. I send you love.",,
"An interesting piece on body positivity here. The battle for media is crucial -- and some of us, almost all of us are standing in the way:",,
Your body doesn't change you. Don't manifest yourself in a negative way. Learn to admire yourself in a way that your friends can. Surround yourself with love and not negative positivity. Just remember that life is too temporary to do anything but love your life.,,
Respect body positivity diet?,,
Andifuna kuva nex about body positivity when I say Im not happy about my weight. Ndifuna ukuncipha Qha.,,
Body positivity has been a blight on humanity. We need to go back to extreme bullying. Its the only way to get people to be healthier.,,
no cause im serious ppl are poking fun of him bcos his looks dont fit the beauty standard.... and i thought we were all for body positivity??,,
its all *body positivity* and *dont shit on people* until its someone you hate. yall are hypocrites,,
BODY POSITIVITY,,
I really enjoyed this article. Can social media ever be truly body positive? via,,
Do we get the most out of our body energy? Do the right thing!,,
Wow thank you for getting me to followers while I was asleep and giving my body positivity post all the support it received. I plan on doing at least one of them a week about either body positivity or mental health. My dms are always open to anyone who wants to talk,,
"You guys are always preaching body positivity and confidence but as soon as a male as Noah beck is confident, you have to bring him down... the hypocrisy",,
"That it's important to stress body positivity to young minds &amp; the idea that thoughts and feelings held so passionately sometimes, can change &amp; should be given the chance to. That we should continue to believe teenage years are 'difficult' &amp; give people the space to grow up first",,
Why dont you treat your body and mind Just like a building. Put in the work necessary to make it healthy and beautiful,,
ur all for no body shaming and body positivity until its the guy whos being body shamed,,
"Body positivity movement: Morbid obese girl being glorified, proceeds to make unhealthy choices and gets praise. Naturally skinny girl being told shes setting a bad example, gets told to eat more, gets told shes got an ED, gets unneeded concern constantly. How it works.",,
I always laugh when people who are against body positivity try to pull a gotcha whenever someone who was about it decides to exercise/work on their body.,,
"""Being overweight is not a problem, BMI was invented in the th centuary by a man so it isn't valid, you're fatphobic, all the doctors with degrees are lying to you and stigmatizing being fat but I'm smart"" Normalizing this and body positivity are VERY different.",,
"When I told my mom that how Social influencers spread the message of body positivity and feeling comfortable in one's weight , she told me that they are just not accepting their own self and looking for appreciation from others to make them less insecure about themselves ,",,
The Perfect Magazine and the body positivity,,
i like how people boast about body positivity unless its a buff or skinny guy/girl.,,
"Superconsciousness is all about intense positivity. It does not end when your body ends operating. When your decides to disintegrate and go back to elements, the does not disintegrate, does not disappear Kailasa's Sri",,
"Yeayea. Yes to body positivity, BUT PLEASE DO NOT PROMOTE OBESITY. Yall be really part of the problem.",,
"""These Body-Positive Self-Portraits Encourage Women To Love Their Flaws"" (though we here at Conscious Being perhaps wouldn't use the term flaws, but bodies/body... but by gosh these portraits are stunning!) via",,
Body positivity + nail art + boobs = our dream internet trend,,
"Hey just a reminder since I see it happening a lot, it's wrong to body shame anyone. Even if they're a bad person. Stop calling bad people fat or making fun of their appearance and then trying to spread body positivity. Dont be a fucking hypocrite.",,
Body positivity bro.,,
